"hotel_id","city_name","name","rating","location","price_per_night","attractions","description","fax_number","hotel_facilities","phone_number","pincode","image_url"
"1","Abu Dhabi","The Ritz Carlton Abu Dhabi Grand Canal","FiveStar","P.O.Box 91888 Al Maqta Area Abu Dhabi ","850","Distances are displayed to the nearest 0.1 mile and kilometer. <br /> <p>Sheikh Zayed Grand Mosque - 1.3 km / 0.8 mi <br /> Salwa Zeidan Gallery - 2.6 km / 1.6 mi <br /> Khalifa Park - 3.3 km / 2 mi <br /> Abu Dhabi Ice Rink - 3.3 km / 2 mi <br /> Al Maqtaa Fort - 3.5 km / 2.2 mi <br /> Miraj Museum - 3.7 km / 2.3 mi <br /> Zayed Sports City Stadium - 3.7 km / 2.3 mi <br /> Khalifa Intl Bowling Centre - 4 km / 2.5 mi <br /> The Souq at Qaryat Al Beri - 4.1 km / 2.5 mi <br /> Al Forsan International Sports Resort - 4.6 km / 2.8 mi <br /> Abu Dhabi National Exhibition Centre - 5.6 km / 3.5 mi <br /> Mangrove Lagoon National Park - 5.9 km / 3.7 mi <br /> Abu Dhabi Golf Club - 7.9 km / 4.9 mi <br /> Mushrif Mall - 10.6 km / 6.6 mi <br /> Mar Thoma Church - 11.2 km / 7 mi <br /> </p><p>The preferred airport for The Ritz-Carlton Abu Dhabi  Grand Canal is Abu Dhabi Intl. Airport (AUH) - 20.7 km / 12.9 mi </p>","<p>HeadLine : Near The Souq at Qaryat Al Beri</p><p>Location : When you stay at The Ritz-Carlton Abu Dhabi, Grand Canal in Abu Dhabi, you ll be on the waterfront, within a 5-minute drive of Sheikh Zayed Grand Mosque and The Souq at Qaryat Al Beri.  This 5-star hotel is 13.5 mi (21.8 km) from Yas Marina Circuit and 14.3 mi (23 km) from Yas Waterworld.</p><p>Rooms : Make yourself at home in one of the 530 air-conditioned rooms featuring minibars and LCD televisions. Your bed comes with down comforters and Egyptian cotton sheets. Complimentary wired and wireless Internet access keeps you connected, and satellite programming provides entertainment. Private bathrooms with separate bathtubs and showers feature designer toiletries and bidets.</p><p>Dining : Stop by the hotel s restaurant, The Forge, for dinner. Dining is also available at the 2 coffee shops/cafes, and 24-hour room service is provided. Wind down with a drink at one of the 2 bars/lounges or 2 poolside bars. Buffet breakfasts are served on weekdays from 6:30 AM to 10:30 AM and on weekends from 6:30 AM to 11:00 AM for a fee.</p><p>CheckIn Instructions : <ul>  <li>Extra-person charges may apply and vary depending on property policy</li><li>Government-issued photo identification and a credit card may be required at check-in for incidental charges</li><li>Special requests are subject to availability upon check-in and may incur additional charges; special requests cannot be guaranteed</li><li>The name on the credit card used at check-in to pay for incidentals must be the primary name on the guestroom reservation</li><li>This property accepts credit cards, debit cards, and cash</li>  </ul></p><p>Special Instructions : Front desk staff will greet guests on arrival.</p>","971-2-8188088","24-hour fitness facilities 24-hour health club Luggage storage Porter/bellhop Business center 24-hour front desk Playground on site Safe-deposit box at front desk Snack bar/deli Children's pool Sauna Steam room Kayaking nearby Free self parking Conference space Beach cabanas (surcharge) Free valet parking Free pool cabanas Beach sun loungers ATM/banking Wheelchair accessible path of travel Pool sun loungers Conference space size (feet) - 16685 Gift shops or newsstand Dry cleaning/laundry service Shopping on site Newspapers in lobby (surcharge) Babysitting or childcare (surcharge) Pool umbrellas Number of meeting rooms - 14 Conference space size (meters) - 1550 Swimming pool Limo or Town Car service available Free WiFi Number of bars/lounges - 2 Designated smoking areas Number of spa tubs - 1 Number of poolside bars - 2 Number of outdoor pools - 2 In-room accessibility (in select rooms) Wheelchair accessible parking Tours/ticket assistance On private beach Wheelchair-accessible lounge Wheelchair-accessible on-site restaurant Visual alarms in hallways Multilingual staff Wheelchairs available on site Breakfast available (surcharge) Marina nearby Wheelchair-accessible meeting spaces/business center Number of coffee shops/cafes - 2 Laundry facilities elevator Children's club (free) Safari nearby Supervised childcare/activities (free) Bicycle rentals on site Banquet hall Wheelchair accessible (may have limitations) Ballroom Wheelchair-accessible concierge desk Beach umbrellas Express check-in Assistive listening devices in meeting rooms Wheelchair-accessible path to elevator Wheelchair-accessible registration desk Wheelchair-accessible fitness center Wheelchair-accessible pool Wheelchair-accessible public washroom Well-lit path to entrance Garden Full-service spa Wedding services Beach towels Concierge services 24-hour business center","971-2-8188888","91888","images/ritz.jpg"
"2","Abu Dhabi","Novotel Abu Dhabi Al Bustan","FourStar","Sheikh Rashid Bin Saeed Street/Rabdan Street P.O. Box 95208Abu Dhabi ","229","Distances are displayed to the nearest 0.1 mile and kilometer. <br /> <p>Abu Dhabi National Exhibition Centre - 2 km / 1.2 mi <br /> Mushrif Mall - 2.4 km / 1.5 mi <br /> Mangrove Lagoon National Park - 2.6 km / 1.6 mi <br /> Al Forsan International Sports Resort - 2.7 km / 1.7 mi <br /> Miraj Museum - 3.3 km / 2.1 mi <br /> Zayed Sports City Stadium - 3.8 km / 2.3 mi <br /> Khalifa Intl Bowling Centre - 3.9 km / 2.5 mi <br /> Abu Dhabi Ice Rink - 4.3 km / 2.7 mi <br /> Al Jazaeera Sports Club - 5.1 km / 3.2 mi <br /> St. Andrew s Church - 5.3 km / 3.3 mi <br /> Evangelical Community Church - 5.5 km / 3.4 mi <br /> Women’s Handicraft Centre - 5.5 km / 3.4 mi <br /> St. George Orthodox Cathedral - 5.6 km / 3.5 mi <br /> Higher Colleges of Technology-Abu Dhabi Men s College - 5.7 km / 3.5 mi <br /> Mushrif Central Park - 5.8 km / 3.6 mi <br /> </p><p>The preferred airport for Novotel Abu Dhabi Al Bustan is Abu Dhabi Intl. Airport (AUH) - 27.2 km / 16.9 mi </p>","<p>HeadLine : Near Khalifa Intl Bowling Centre</p><p>Location : Located in Abu Dhabi, Novotel Abu Dhabi Al Bustan is in the business district, within a 5-minute drive of Abu Dhabi National Exhibition Centre and Zayed Sports City Stadium.  This 4-star hotel is 5 mi (8.1 km) from Sheikh Zayed Grand Mosque and 6.7 mi (10.8 km) from Abu Dhabi Mall.</p><p>Rooms : Make yourself at home in one of the 361 individually decorated guestrooms, featuring MP3 docking stations and minibars. Wired and wireless Internet access is complimentary, while 42-inch LCD televisions with satellite programming provide entertainment. Private bathrooms with separate bathtubs and showers feature complimentary toiletries and bidets. Conveniences include phones, as well as laptop-compatible safes and separate sitting areas.</p><p>Dining : Enjoy international cuisine at Pepper Restaurant, one of the hotel s 2 restaurants, or stay in and take advantage of the 24-hour room service. Snacks are also available at the coffee shop/cafe. Relax with your favorite drink at the bar/lounge or the poolside bar. Buffet breakfasts are served on weekdays from 6:30 AM to 10:30 AM and on weekends from 6:30 AM to 11 AM for a fee.</p><p>CheckIn Instructions : <ul>  <li>Extra-person charges may apply and vary depending on property policy</li><li>Government-issued photo identification and a credit card, debit card, or cash deposit may be required at check-in for incidental charges</li><li>Special requests are subject to availability upon check-in and may incur additional charges; special requests cannot be guaranteed</li><li>Minimum Spring Break check-in age is 18 years old</li><li>This property accepts credit cards, debit cards, and cash</li><li>Safety features at this property include a fire extinguisher, a smoke detector, a security system, and a first aid kit</li>  </ul></p><p>Special Instructions : Front desk staff will greet guests on arrival.</p>","971-2-5086333","Roll-in shower (in select rooms) Tours/ticket assistance Accessible bathroom (in select rooms) Wheelchair-accessible lounge Wheelchair-accessible on-site restaurant Visual alarms in hallways Multilingual staff Handrails in stairways Conference center Electric car charging station Wheelchairs available on site Breakfast available (surcharge) Wheelchair-accessible meeting spaces/business center Gift shops or newsstand Dry cleaning/laundry service Coffee/tea in common areas Pool umbrellas Number of coffee shops/cafes - 1 Conference space size (meters) - 1385 Swimming pool Free wired Internet Free WiFi Number of bars/lounges - 1 Designated smoking areas Number of spa tubs - 1 Number of poolside bars - 1 Number of outdoor pools - 1 In-room accessibility (in select rooms) Wheelchair accessible parking Laundry facilities elevator Fitness facilities Covered parking Banquet hall Wheelchair accessible (may have limitations) Wheelchair accessible Wheelchair-accessible concierge desk Reception hall Wheelchair-accessible van parking Meeting rooms Wheelchair-accessible path to elevator Valet for wheelchair-equipped vehicle Wheelchair-accessible spa Wheelchair-accessible registration desk Wheelchair-accessible fitness center Wheelchair-accessible pool Wheelchair-accessible public washroom Spa treatment room(s) Garden Free newspapers in lobby Wedding services Luggage storage Express check-out Grocery/convenience store Porter/bellhop Business center 24-hour front desk Lifeguard on site Spa services on site Safe-deposit box at front desk Snack bar/deli Children's pool Sauna Steam room Free self parking Conference space Hair salon Computer station Terrace ATM/banking Wheelchair accessible path of travel Pool sun loungers Conference space size (feet) - 14908 Concierge services","971-2-5016444","0","images/novotel.jpg"
"3","Abu Dhabi","Rosewood Abu Dhabi","FiveStar","Al Maryah Island 41184 Al Maryah IslandAbu Dhabi ","630","Distances are displayed to the nearest 0.1 mile and kilometer. <br /> <p>The Galleria - 0.1 km / 0.1 mi <br /> Cleveland Clinic Abu Dhabi - 0.5 km / 0.3 mi <br /> Khalifa Center - 1 km / 0.6 mi <br /> Kidoos Entertainment - 1 km / 0.6 mi <br /> Abu Dhabi Mall - 1.3 km / 0.8 mi <br /> Abu Dhabi Commercial Bank - 1.9 km / 1.2 mi <br /> Abu Dhabi Corniche - 2.5 km / 1.5 mi <br /> Al Reem Mall - 2.7 km / 1.7 mi <br /> Iranian Souq - 2.9 km / 1.8 mi <br /> Carpet Souk - 3 km / 1.9 mi <br /> Capital Garden - 3.1 km / 1.9 mi <br /> Madinat Zayed Shopping Center - 3.2 km / 2 mi <br /> Fruit and Vegetable Souq - 3.7 km / 2.3 mi <br /> World Trade Center Mall - 3.7 km / 2.3 mi <br /> Traditional Souqs - 3.7 km / 2.3 mi <br /> </p><p>The preferred airport for Rosewood Abu Dhabi is Abu Dhabi Intl. Airport (AUH) - 34.3 km / 21.3 mi </p>","<p>HeadLine : Near Kidoos Entertainment</p><p>Location : When you stay at Rosewood Abu Dhabi in Abu Dhabi, you ll be connected to a shopping center, just steps from The Galleria and 5 minutes by foot from Cleveland Clinic Abu Dhabi.  This 5-star hotel is 1.3 mi (2.1 km) from Abu Dhabi Mall and 2.7 mi (4.4 km) from Corniche Beach.</p><p>Rooms : Make yourself at home in one of the 189 guestrooms featuring refrigerators and minibars. Wired and wireless Internet access is complimentary, while 55-inch flat-screen televisions with satellite programming provide entertainment. Private bathrooms with separate bathtubs and showers feature complimentary toiletries and hair dryers. Conveniences include phones, as well as desks and complimentary newspapers.</p><p>Dining : Enjoy Mediterranean cuisine at Aqua, one of the hotel s 3 restaurants, or stay in and take advantage of the 24-hour room service. Snacks are also available at the coffee shop/cafe. Relax with a refreshing drink from the poolside bar or one of the 3 bars/lounges. Buffet breakfasts are served on weekdays from 6:30 AM to 10:30 AM and on weekends from 6:30 AM to 11 AM for a fee.</p><p>CheckIn Instructions : <ul>  <li>Extra-person charges may apply and vary depending on property policy</li><li>Government-issued photo identification and a credit card, debit card, or cash deposit may be required at check-in for incidental charges</li><li>Special requests are subject to availability upon check-in and may incur additional charges; special requests cannot be guaranteed</li><li>The name on the credit card used at check-in to pay for incidentals must be the primary name on the guestroom reservation</li><li>Guests must contact this property in advance to reserve cribs/infant beds and rollaway/extra beds</li><li>This property accepts credit cards, debit cards, and cash</li><li>Long-term renters welcome</li><li>Safety features at this property include a fire extinguisher, a smoke detector, a security system, and a first aid kit</li>  </ul></p><p>Special Instructions : Front desk staff will greet guests on arrival.</p>","971-28-135551","Dry cleaning/laundry service Proposal/romance packages available Babysitting or childcare (surcharge) Pool umbrellas Number of meeting rooms - 11 Conference space size (meters) - 968 Swimming pool Free wired Internet Free WiFi Number of bars/lounges - 3 Designated smoking areas Number of spa tubs - 1 Number of poolside bars - 1 Number of outdoor pools - 1 Assistive listening devices available In-room accessibility (in select rooms) Wheelchair accessible parking Roll-in shower (in select rooms) Tours/ticket assistance Accessible bathroom (in select rooms) Multilingual staff Breakfast available (surcharge) Wheelchair-accessible meeting spaces/business center Coffee/tea in common areas Number of coffee shops/cafes - 1 Laundry facilities elevator Children's club (free) Fitness facilities Wine release events Tasting room Banquet hall Wheelchair accessible (may have limitations) Wheelchair accessible Express check-in Wheelchair-accessible registration desk Wheelchair-accessible public washroom Health club Spa treatment room(s) Stair-free path to entrance Free newspapers in lobby Full-service spa Wedding services Shopping mall on site Couples/private dining Designer stores on site Luggage storage Express check-out Porter/bellhop Business center 24-hour front desk Golfing nearby Safe-deposit box at front desk Snack bar/deli Children's pool Sauna Steam room Free self parking Conference space Free valet parking Hair salon Computer station Terrace Wheelchair accessible path of travel Conference space size (feet) - 10420 Concierge services","971-28-135550","0","images/rosewood.jpg"
"4","Abu Dhabi","Millennium Downtown Abu Dhabi","FiveStar","Hamdan Street Po Box 3541 3541 Abu Dhabi P.O.Box: 3541Abu Dhabi ","540","Distances are displayed to the nearest 0.1 mile and kilometer. <br /> <p>Capital Garden - 0.6 km / 0.4 mi <br /> Madinat Zayed Shopping Center - 0.9 km / 0.6 mi <br /> World Trade Center Mall - 0.9 km / 0.6 mi <br /> Abu Dhabi Corniche - 1.1 km / 0.7 mi <br /> Al Hosn University - 1.2 km / 0.7 mi <br /> Abu Dhabi Commercial Bank - 1.2 km / 0.8 mi <br /> Central Market - 1.3 km / 0.8 mi <br /> Cultural Foundation - 1.4 km / 0.9 mi <br /> Al-Hosn Palace - 1.7 km / 1 mi <br /> Qasr Al Hosn Centre - 1.8 km / 1.1 mi <br /> Corniche Beach - 2 km / 1.2 mi <br /> Khalifa Center - 2.2 km / 1.4 mi <br /> Abu Dhabi Mall - 2.2 km / 1.4 mi <br /> Fun World - 2.2 km / 1.4 mi <br /> Kidoos Entertainment - 2.3 km / 1.4 mi <br /> </p><p>The nearest major airport is Abu Dhabi Intl. Airport (AUH) - 36 km / 22.4 mi</p>","<p>HeadLine : In Abu Dhabi (Abu Dhabi City Center)</p><p>Location : With a stay at Millennium Downtown, you ll be centrally located in Abu Dhabi, a 7-minute walk from Capital Garden and 13 minutes by foot from Abu Dhabi Corniche.  This 5-star hotel is 1.6 mi (2.6 km) from Abu Dhabi Mall and 4.9 mi (7.9 km) from Louvre Abu Dhabi.</p><p>Rooms : Make yourself at home in one of the 236 guestrooms featuring minibars. Your pillowtop bed comes with premium bedding. Complimentary wireless Internet access keeps you connected, and satellite programming is available for your entertainment. Private bathrooms have deep soaking bathtubs and rainfall showerheads.</p><p>Dining : Grab a bite at Cappuccino s Cafe, one of the hotel s 4 restaurants, or stay in and take advantage of the 24-hour room service. Snacks are also available at the coffee shop/cafe. Wrap up your day with a drink at the poolside bar. Buffet breakfasts are available daily from 6 AM to 10:30 AM for a fee.</p><p>CheckIn Instructions : <ul>  <li>Extra-person charges may apply and vary depending on property policy</li><li>Government-issued photo identification and a credit card, debit card, or cash deposit may be required at check-in for incidental charges</li><li>Special requests are subject to availability upon check-in and may incur additional charges; special requests cannot be guaranteed</li><li>The name on the credit card used at check-in to pay for incidentals must be the primary name on the guestroom reservation</li><li>This property accepts credit cards, debit cards, and cash</li><li>Safety features at this property include a carbon monoxide detector, a fire extinguisher, a smoke detector, a security system, a first aid kit, and window guards</li><li>Please note that cultural norms and guest policies may differ by country and by property; the policies listed are provided by the property</li>  </ul></p><p>Special Instructions : This property offers transfers from the airport (surcharges may apply). To arrange pick-up, guests must contact the property 24 hours prior to arrival, using the contact information on the booking confirmation. Front desk staff will greet guests on arrival.  Guests booked in breakfast included rate plans receive breakfast for up to 2 adults who are sharing a guestroom. Breakfast fees apply for additional guests. Guests booked in dinner included rate plans receive dinner for up to 2 adults who are sharing a guestroom. Dinner fees apply for additional guests.</p>","971-2-6217444","Dry cleaning/laundry service Parking (limited spaces) Airport transportation Pool umbrellas Number of meeting rooms - 3 Conference space size (meters) - 912 Free WiFi Designated smoking areas Number of poolside bars - 1 Number of outdoor pools - 1 Assistive listening devices available In-room accessibility (in select rooms) Wheelchair accessible parking Roll-in shower (in select rooms) Tours/ticket assistance Accessible bathroom (in select rooms) Airport transportation (surcharge) Accessible airport shuttle No accessible shuttle Visual alarms in hallways Multilingual staff Conference center Wheelchairs available on site Breakfast available (surcharge) Number of accessible parking spaces - 2 Number of coffee shops/cafes - 1 Laundry facilities elevator Fitness facilities Covered parking Uncovered parking Banquet hall Uncovered parking Wheelchair accessible (may have limitations) Ballroom Covered parking Express check-in Television in common areas Wheelchair-accessible fitness center Wheelchair-accessible public washroom Health club Spa treatment room(s) Well-lit path to entrance Free newspapers in lobby 24-hour fitness facilities Elevator door width (inches) - 63 Elevator door width (centimeters) - 160 Luggage storage Porter/bellhop Business center 24-hour front desk Safe-deposit box at front desk Sauna Steam room Free self parking Conference space Free valet parking Hair salon Wheelchair accessible path of travel Pool sun loungers Conference space size (feet) - 9816 Concierge services 24-hour business center","971-2-6166166","3541","images/millenium.jpg"
"5","Abu Dhabi","Centro Capital Centre by Rotana","ThreeStar","Al Khaleej Al Arabi Street Capital Centre Adjacent To Adnec Exhibition Centre Adjacent to ADNEC Exhibition Centre P.O. Box 44493Abu Dhabi ","132","Distances are displayed to the nearest 0.1 mile and kilometer. <br /> <p>Abu Dhabi National Exhibition Centre - 0.5 km / 0.3 mi <br /> Sheikh Zayed Stadium - 2 km / 1.2 mi <br /> Miraj Museum - 2.5 km / 1.5 mi <br /> Abu Dhabi Ice Rink - 2.6 km / 1.6 mi <br /> Mushrif Mall - 4 km / 2.5 mi <br /> Sheikh Zayed Grand Mosque - 4.8 km / 3 mi <br /> Mangrove Lagoon National Park - 4 km / 2.5 mi <br /> Al Maqtaa Fort - 7.5 km / 4.7 mi <br /> Al Jazaeera Sports Club - 7.6 km / 4.7 mi <br /> St. Andrew s Church - 7.7 km / 4.8 mi <br /> The Souq at Qaryat Al Beri - 7.8 km / 4.9 mi <br /> Women’s Handicraft Centre - 8.1 km / 5 mi <br /> Higher Colleges of Technology-Abu Dhabi Men s College - 8.3 km / 5.2 mi <br /> Abu Dhabi Equestrian Club - 8.5 km / 5.3 mi <br /> Evangelical Community Church - 8.6 km / 5.4 mi <br /> </p><p>The preferred airport for Centro Capital Centre is Abu Dhabi Intl. Airport (AUH) - 23.5 km / 14.6 mi </p>","<p>HeadLine : Near Abu Dhabi National Exhibition Centre</p><p>Location : With a stay at Centro Capital Centre in Abu Dhabi (Capital Centre), you ll be a 1-minute drive from Abu Dhabi National Exhibition Centre and 10 minutes from Sheikh Zayed Grand Mosque.  This hotel is 5.9 mi (9.4 km) from Khalifa Park.</p><p>Rooms : Make yourself at home in one of the 414 guestrooms featuring refrigerators and Smart televisions. Complimentary wired and wireless Internet access keeps you connected, and satellite programming provides entertainment. Private bathrooms with showers feature rainfall showerheads and complimentary toiletries. Conveniences include phones, as well as safes and desks.</p><p>Dining : Stop by c.taste restaurant for lunch, dinner, or brunch, where this restaurant specializes in international cuisine. Dining is also available at the coffee shop/café, and 24-hour room service is provided. Wrap up your day with a drink at the bar/lounge. Buffet breakfasts are available daily from 6 AM to 10:30 AM for a fee.</p><p>CheckIn Instructions : Extra-person charges may apply and vary depending on property policy. <br />Government-issued photo identification and a credit card, debit card, or cash deposit may be required at check-in for incidental charges. <br />Special requests are subject to availability upon check-in and may incur additional charges. Special requests cannot be guaranteed.  <ul><li>Minimum Spring Break check-in age is 18 years old. </li><li>The name on the credit card used at check-in to pay for incidentals must be the primary name on the guestroom reservation. </li>Guests must contact this property in advance to reserve rollaway/extra beds. Heating is not provided. Onsite parties or group events are strictly prohibited. This property uses eco-friendly cleaning products. Long-term renters welcome. Safety features at this property include a carbon monoxide detector and a smoke detector. <li>This property advises that enhanced cleaning and guest safety measures are currently in place.</li><li>Disinfectant is used to clean the property; commonly-touched surfaces are cleaned with disinfectant between stays; bed sheets and towels are laundered at a temperature of at least 60°C/140°F.</li><li>Personal protective equipment, including masks and gloves, will be available to guests.</li><li>Social distancing measures are in place; staff at the property wear personal protective equipment; a shield is in place between staff and guests in main contact areas; periodic temperature checks are conducted on staff; temperature checks are available to guests.</li><li>Contactless check-in and contactless check-out are available.</li><li>Individually-wrapped food options are available for breakfast, lunch, and dinner, and also through room service.</li><li>Each guestroom is kept vacant for a minimum of 48 hours between bookings.</li>Please note that cultural norms and guest policies may differ by country and by property. The policies listed are provided by the property. </ul></p><p>Special Instructions : Front desk staff will greet guests on arrival. For more details, please contact the property using the information on the booking confirmation.  This property requires a valid passport or Emirates ID for all guests at check-in, regardless of age.</p>","971-2-4096409","Express check-in Couples/private dining Bar/lounge elevator 24-hour front desk Restaurant Meeting rooms Tours/ticket assistance Coffee shop or café Dry cleaning/laundry service Free WiFi Pool sun loungers Outdoor pool Limo or Town Car service available Free wired Internet Swimming pool Safe-deposit box at front desk Luggage storage Proposal/romance packages available Breakfast available (surcharge) 24-hour business center Conference space size (feet) - 1249 Designated smoking areas Wheelchair accessible (may have limitations) Pool umbrellas Laundry facilities 24-hour fitness facilities Wheelchair accessible parking In-room accessibility Multilingual staff Free newspapers in lobby Eco-friendly cleaning products used","971-2-4096666","44493","images/centro capital.jpg"
