"hotel_id","city_name","name","rating","location","price_per_night","attractions","description","fax_number","hotel_facilities","phone_number","pincode","image_url"
"11","Ajman","Ajman Saray a Luxury Collection Resort","FiveStar","Sheikh Humaid Bin Rashid Al Nuaimi Street Ajman 8833 ","531","Distances are displayed to the nearest 0.1 mile and kilometer. <br /> <p>Ajman Museum - 1.1 km / 0.7 mi <br /> Ajman Free Zone - 1.5 km / 0.9 mi <br /> Ajman Beach - 2.1 km / 1.3 mi <br /> Ajman Ladies Park - 3.2 km / 2 mi <br /> Safeer Mall - 4.8 km / 3 mi <br /> Sharjah Ladies Club - 7 km / 4.3 mi <br /> Corniche Mosque - 8 km / 5 mi <br /> St. Gregory the illuminator Armenian Church - 8.7 km / 5.4 mi <br /> City Centre Ajman - 8.7 km / 5.4 mi <br /> Sharjah Museum of Islamic Civilisation - 8.8 km / 5.5 mi <br /> Islamic Museum - 9 km / 5.6 mi <br /> Rolla Mall - 9.1 km / 5.7 mi <br /> Sharjah Art Museum - 9.2 km / 5.7 mi <br /> Very Special Arts Centre - 9.3 km / 5.8 mi <br /> Sharjah Heritage Area - 9.4 km / 5.8 mi <br /> </p><p>The nearest airports are:<br />Dubai Intl. Airport (DXB) - 32.6 km / 20.3 mi<br /> Sharjah (SHJ-Sharjah Intl.) - 21.4 km / 13.3 mi<br /> </p><p>The preferred airport for Ajman Saray  a Luxury Collection Resort  Ajman is Dubai Intl. Airport (DXB). </p>","<p>HeadLine : Near Al Zorah Beach</p><p>Location : When you stay at Ajman Saray, a Luxury Collection Resort, Ajman in Ajman, you ll be on the waterfront, within a 5-minute drive of Ajman Museum and Ajman Beach.  This 5-star resort is 5.4 mi (8.7 km) from City Centre Ajman and 8.9 mi (14.3 km) from Sharjah Aquarium.</p><p>Rooms : Make yourself at home in one of the 205 air-conditioned rooms featuring iPod docking stations and minibars. Your room comes with a pillowtop bed. 40-inch LED televisions with cable programming provide entertainment, while complimentary wireless Internet access keeps you connected. Private bathrooms with separate bathtubs and showers feature designer toiletries and bidets.</p><p>Dining : Enjoy barbecue at Bab Al Bahr Beach Bar, one of the resort s 4 restaurants, or stay in and take advantage of the 24-hour room service. Snacks are also available at the coffee shop/cafe. Unwind at the end of the day with a drink at the bar/lounge or the beach bar.</p><p>CheckIn Instructions : <ul>  <li>Extra-person charges may apply and vary depending on property policy</li><li>Government-issued photo identification and a credit card, debit card, or cash deposit may be required at check-in for incidental charges</li><li>Special requests are subject to availability upon check-in and may incur additional charges; special requests cannot be guaranteed</li><li>This property accepts credit cards, debit cards, and cash</li><li>Safety features at this property include a smoke detector</li>  </ul></p><p>Special Instructions : Front desk staff will greet guests on arrival.</p>","971-6-7142223","Laundry facilities elevator Children's club (free) Fitness facilities Supervised childcare/activities (free) Bicycle rentals on site Mountain biking nearby Banquet hall Wheelchair accessible (may have limitations) Ballroom Wheelchair-accessible concierge desk Beach umbrellas Table tennis Reception hall Wheelchair-accessible van parking Wheelchair-accessible path to elevator Wheelchair-accessible spa Wheelchair-accessible registration desk Wheelchair-accessible fitness center Wheelchair-accessible pool Spa treatment room(s) Garden Free newspapers in lobby Full-service spa Wedding services Beach towels 24-hour fitness facilities Yoga classes/instruction on site Couples/private dining Luggage storage Porter/bellhop Business center 24-hour front desk Playground on site Racquetball/squash on site Babysitting or childcare (surcharge) Pool umbrellas Number of meeting rooms - 610 Conference space size (meters) - 216 Swimming pool Limo or Town Car service available Free WiFi Number of bars/lounges - 1 Designated smoking areas Number of outdoor pools - 2 Number of beach bars - 1 In-room accessibility (in select rooms) Wheelchair accessible parking Roll-in shower (in select rooms) Tours/ticket assistance Accessible bathroom (in select rooms) Fitness classes on site On private beach Wheelchair-accessible on-site restaurant Visual alarms in hallways Multilingual staff Wheelchair-accessible meeting spaces/business center Turkish bath/Hammam Number of coffee shops/cafes - 1 Spa services on site Safe-deposit box at front desk Hiking/biking trails nearby Children's pool Steam room Free self parking Conference space Free valet parking Hair salon Computer station Beach sun loungers Terrace ATM/banking Wheelchair accessible path of travel Pool sun loungers Conference space size (feet) - 2325 Concierge services 24-hour business center","97167142222","8833","images/ajman saray.jpg
"
"12","Ajman","Dream Palace Hotel","TwoStar","Sheikh Rashed Bin Humid Al RumailahP.O. Box 14466Ajman 14466 ","120",,"This design hotel in the heart of Ajman’s business district offers spacious rooms with a modern design. All rooms have free wired internet and a satellite TV.

Kitchen facilities include a refrigerator and a microwave. Some of Dream Palace Hotel’s rooms come with a seating area and a balcony with views of the city.

Saudi Ajman Mosque is a 5-minute walk away while the hotel is a 5-minute drive from Ajman Cultural Centre.

Dream Palace Hotel offers an airport shuttle service. Guests can benefit from the 24-hour reception desk.

Sharjah International Airport is a 15-minute drive from the hotel.","97167417071","Fire extinguishers use of cleaning chemicals that are effective against coronavirus linens  towels and laundry washed in accordance with local authority guidelines guest accommodation is disinfected between stays guest accommodation sealed after cleaning physical distancing in dining areas food can be delivered to guest accommodation staff follow all safety protocols as directed by local authorities shared stationery such as printed menus  magazines  pens  and paper removed hand sanitizer in guest accommodation and key areas process in place to check health of guests first aid kit available contactless check-in/check-out cashless payment available physical distancing rules followed screens or physical barriers placed between staff and guests in appropriate areas invoice provided property is cleaned by professional cleaning companies guests have the option to cancel any cleaning services for their accommodation during their stay breakfast takeaway containers delivered food is securely covered thermometers for guests provided by property face masks for guests available Room service 24-hour front desk Non-smoking rooms Airport shuttle Laundry dry cleaning Family rooms breakfast in the room Ironing service internet services lift express check-in/check-out Safety Deposit Box Currency exchange Spa and wellness centre Massage Car hire Fax/photocopying Foot massage Hand massage Full body massage Key card access Smoke alarms Luggage storage wifi Free WiFi Air conditioning Snack Bar CCTV in common areas CCTV outside property concierge service airport shuttle (additional charge) Lockers minimarket on site grocery deliveries airport pick up airport drop off coffee house on site Back massage","97167417070","14466","images/dreampalace.jpg"
"13","Ajman","Ramada Hotel & Suites Ajman","FourStar","Sheikh Khalifa Bin Zayed Street PO Box 31631 P.O. Box 31631Ajman ","321","Distances are displayed to the nearest 0.1 mile and kilometer. <br /> <p>Safeer Mall - 1.9 km / 1.2 mi <br /> Ajman Ladies Park - 2.6 km / 1.6 mi <br /> City Centre Ajman - 3.5 km / 2.2 mi <br /> Ajman Museum - 4.2 km / 2.6 mi <br /> Ajman Free Zone - 4.4 km / 2.7 mi <br /> Ajman Beach - 5.6 km / 3.5 mi <br /> Haider Arts - 5.9 km / 3.6 mi <br /> Thumbay Medicity - 7 km / 4.3 mi <br /> Gulf Medical College - 7.1 km / 4.4 mi <br /> Sharjah Ladies Club - 7.9 km / 4.9 mi <br /> Ajman University - 8.2 km / 5.1 mi <br /> Corniche Mosque - 8.9 km / 5.5 mi <br /> St. Gregory the illuminator Armenian Church - 9 km / 5.6 mi <br /> Hamidiya Mosque - 9.1 km / 5.7 mi <br /> Sharjah Museum of Islamic Civilisation - 9.1 km / 5.7 mi <br /> </p><p>The nearest airports are:<br />Sharjah (SHJ-Sharjah Intl.) - 19.3 km / 12 mi<br /> Dubai Intl. Airport (DXB) - 30.5 km / 19 mi<br /> </p><p>The preferred airport for Ramada Hotel & Suites by Wyndham Ajman is Sharjah (SHJ-Sharjah Intl.). </p>","<p>HeadLine : Near Safeer Mall</p><p>Location : A stay at Ramada Hotel & Suites by Wyndham Ajman places you in the heart of Ajman, within a 5-minute drive of Safeer Mall and Ajman Ladies Park.  This 4-star hotel is 15.9 mi (25.5 km) from Dubai Creek and 2.4 mi (3.9 km) from Ajman Museum.</p><p>Rooms : Make yourself at home in one of the 365 individually decorated guestrooms, featuring kitchenettes with full-sized refrigerators/freezers and microwaves. Your bed comes with down comforters and premium bedding, and all rooms are furnished with sofa beds. Complimentary wired and wireless Internet access keeps you connected, and satellite programming provides entertainment. Conveniences include phones, as well as safes and desks.</p><p>Dining : All-inclusive rates are available at this hotel. Meals and beverages at onsite dining establishments are included in all-inclusive rates. Charges may be applied for dining at some restaurants, special dinners and dishes, some beverages, and other amenities. <p>For lunch or dinner, stop by Orchid Restaurant, a restaurant that specializes in international cuisine. Dining is also available at the coffee shop/cafe, and 24-hour room service is provided. Buffet breakfasts are available daily from 7:00 AM to 10:30 AM for a fee. </p></p><p>CheckIn Instructions : <ul>  <li>Extra-person charges may apply and vary depending on property policy</li><li>Government-issued photo identification and a credit card, debit card, or cash deposit may be required at check-in for incidental charges</li><li>Special requests are subject to availability upon check-in and may incur additional charges; special requests cannot be guaranteed</li><li>The name on the credit card used at check-in to pay for incidentals must be the primary name on the guestroom reservation</li><li>This property accepts credit cards; cash is not accepted</li><li>This property uses eco-friendly cleaning products</li><li>Safety features at this property include a fire extinguisher, a smoke detector, a security system, a first aid kit, and window guards</li>  </ul></p><p>Special Instructions : This property offers transfers from the airport (surcharges may apply). To arrange pick-up, guests must contact the property 48 hours prior to arrival, using the contact information on the booking confirmation. Front desk staff will greet guests on arrival.</p>","971-6-740 30 00","Wedding services Beach towels 24-hour business center Free beach shuttle Water-efficient toilets only Water dispenser use by guests actively encouraged Luggage storage Private beach nearby Water-efficient showers only Express check-out Grocery/convenience store Billiards or pool table Business center 24-hour front desk Spa services on site Housekeeping on request Safe-deposit box at front desk Children's pool Sauna Steam room Free self parking Conference space Free valet parking Hair salon ATM/banking Conference space size (feet) - 710 Concierge services Gift shops or newsstand Dry cleaning/laundry service Comprehensive recycling policy Vegetarian breakfast available Babysitting or childcare (surcharge) Eco-friendly cleaning products used Conference space size (meters) - 66 Limo or Town Car service available Free WiFi Designated smoking areas Number of indoor pools - 1 In-room accessibility (in select rooms) Bicycle rentals nearby Garden Internet access in public areas - high speed Wheelchair accessible parking Free newspapers in lobby Tours/ticket assistance Full-service spa Accessible bathroom (in select rooms) Free shopping center shuttle Airport transportation (surcharge) Comprehensive food waste policy Vegetable garden Eco-friendly toiletries Energy-saving switches Eco-friendly cleaning products provided Energy-saving features in guest rooms Recycling LED light bulbs Vegan menu options available Wheelchair-accessible on-site restaurant Vegetarian menu options available Multilingual staff Conference center Water dispenser Breakfast available (surcharge) Turkish bath/Hammam Coffee/tea in common areas Number of coffee shops/cafes - 1 Laundry facilities elevator Fitness facilities Double-glazing on all windows Guest education on local ecosystems and culture Banquet hall Wheelchair accessible (may have limitations) Covered parking Wheelchair-accessible concierge desk Beach umbrellas Locally-owned & organized tours & activities Express check-in Meeting rooms Change of bed sheets (on request) Wheelchair-accessible registration desk Television in common areas Change of towels (on request)","971-6-7031111","31631","images/ramada.jpg
"
"14","Al Ain","Al Massa Hotel","OneStar","Al Ain Municipality Roundabout Al Ain ","178","Distances are displayed to the nearest 0.1 mile and kilometer. <br /> <p>Al Jimi Mall - 1.8 km / 1.1 mi <br /> United Arab Emirates University - 2.4 km / 1.5 mi <br /> Qasr al Muwaiji - 3.3 km / 2.1 mi <br /> Jahili Public Park - 3.9 km / 2.4 mi <br /> Al Jahili Fort - 4.2 km / 2.6 mi <br /> Sheikh Zayed Palace Museum - 6.4 km / 4 mi <br /> St. Mary s Catholic Church - 6.6 km / 4.1 mi <br /> Wahat Hili Mall - 6.9 km / 4.3 mi <br /> Al Ain Mall - 7 km / 4.3 mi <br /> Al Ain Oasis Park - 7 km / 4.3 mi <br /> Al Ain National Museum - 7.2 km / 4.5 mi <br /> Al Ain Zoo - 8.4 km / 5.2 mi <br /> Higher Colleges of Technology-Al Ain Women s College - 8.8 km / 5.5 mi <br /> Hili Archaeological Park - 9.6 km / 6 mi <br /> Hili Fun City - 10 km / 6.2 mi <br /> </p><p>The preferred airport for Al Massa Hotel is Al Ain (AAN) - 16.2 km / 10 mi </p>","<p>HeadLine : Near Al Jimi Mall</p><p>Location : With a stay at Al Massa Hotel in Al Ain, you ll be within a 15-minute drive of Al Ain Zoo and United Arab Emirates University.  This hotel is 1.1 mi (1.8 km) from Al Jimi Mall and 2.1 mi (3.3 km) from Qasr al Muwaiji.</p><p>Rooms : Make yourself at home in one of the 62 air-conditioned guestrooms. Satellite television is provided for your entertainment. Bathrooms with bathtubs or showers are provided. Conveniences include phones, housekeeping is provided daily, and you can request rollaway/extra beds (surcharge).</p><p>Dining : Take advantage of the hotel s 24-hour room service.</p><p>CheckIn Instructions : Extra-person charges may apply and vary depending on property policy. <br />Government-issued photo identification and a credit card are required at check-in for incidental charges. <br />Special requests are subject to availability upon check-in and may incur additional charges. Special requests cannot be guaranteed.  <ul><li>The name on the credit card used at check-in to pay for incidentals must be the primary name on the guestroom reservation. </li>Please note that cultural norms and guest policies may differ by country and by property. The policies listed are provided by the property. </ul> Guests must contact this hotel in advance to reserve a rollaway bed. Contact the office using the information on the reservation confirmation received after booking.</p>","971-3-7627500","Television in common areas Accessible bathroom Free self parking Free WiFi In-room accessibility Elevator/lift Concierge services 24-hour front desk","971-37039073","19483","images/al massa.jpg
"
"15","Dubai","Anantara The Palm Dubai Resort","FiveStar","Palm Jumeirah, East Crescent P.O. Box 71607East CrescentPalm Jumeirah ","1568","Distances are displayed to the nearest 0.1 mile and kilometer. <br /> <p>Aquaventure - 4.6 km / 2.8 mi <br /> Lost Chambers - 4.6 km / 2.9 mi <br /> The Pointe - 8.7 km / 5.4 mi <br /> The View at The Palm - 11 km / 6.9 mi <br /> Nakheel Mall - 11.1 km / 6.9 mi <br /> Al Sufouh Beach - 13.9 km / 8.6 mi <br /> American University of Dubai (AUD) - 14.2 km / 8.8 mi <br /> Dubai Marina Mall - 15.5 km / 9.6 mi <br /> The Walk - 15.9 km / 9.9 mi <br /> Skydive Dubai - 15.9 km / 9.9 mi <br /> Jebel Ali Race Course - 16 km / 9.9 mi <br /> Marina Beach - 16 km / 10 mi <br /> Mohammad Bin Ahmed Al Mulla Mosque - 16 km / 10 mi <br /> The Beach Mall - 16.5 km / 10.3 mi <br /> Wild Wadi Water Park - 16.7 km / 10.4 mi <br /> </p><p>The nearest airports are:<br />Dubai Intl. Airport (DXB) - 41 km / 25.5 mi<br /> Al Maktoum Intl. Airport (DWC) - 51.3 km / 31.9 mi<br /> Sharjah (SHJ-Sharjah Intl.) - 67.3 km / 41.8 mi<br /> </p><p>The preferred airport for Anantara The Palm Dubai Resort is Dubai Intl. Airport (DXB). </p>","<p>HeadLine : Near Aquaventure</p><p>Location : With a stay at Anantara The Palm Dubai Resort in Dubai (Palm Jumeirah), you ll be within a 10-minute drive of Aquaventure and Lost Chambers.  This 5-star hotel is 10 mi (16 km) from Marina Beach and 9.6 mi (15.5 km) from Dubai Marina Mall.</p><p>Rooms : Make yourself at home in one of the 293 individually decorated guestrooms, featuring minibars and LCD televisions. Rooms have private furnished balconies. Complimentary wired and wireless Internet access keeps you connected, and cable programming provides entertainment. Private bathrooms with showers feature rainfall showerheads and complimentary toiletries.</p><p>Dining : Enjoy international cuisine at Crescendo, one of the hotel s 4 restaurants, or stay in and take advantage of the room service. Wrap up your day with a drink at the bar/lounge, the beach bar, or the poolside bar. Buffet breakfasts are available daily from 6 AM to 10 AM for a fee.</p><p>CheckIn Instructions : <ul>  <li>Extra-person charges may apply and vary depending on property policy</li><li>Government-issued photo identification and a credit card, debit card, or cash deposit may be required at check-in for incidental charges</li><li>Special requests are subject to availability upon check-in and may incur additional charges; special requests cannot be guaranteed</li><li>Guests must contact this property in advance to reserve cribs/infant beds and rollaway/extra beds</li><li>This property accepts credit cards, debit cards, and cash</li><li>Long-term renters welcome</li><li>Please note that cultural norms and guest policies may differ by country and by property; the policies listed are provided by the property</li>  </ul> <ul>  <li>To check in, all guests are required to present a valid government-issued ID card, in compliance with UAE Emirates law. Valid passport, UAE Emirates ID, GCC (Gulf Cooperation Council) IDs are accepted.</li><li>The ""Standard Room (Residence Building)"" is located at the property s apartment building (Anantara Residences) and shares the same facilities as the resort.</li>  </ul></p><p>Special Instructions : Front desk staff will greet guests on arrival. For more details, please contact the property using the information on the booking confirmation.</p>","971-4-5678009","Surfing/bodyboarding nearby Free self parking Free valet parking Kayaking on site Tennis on site Beach sun loungers Terrace Pool sun loungers Concierge services Ballroom Meeting rooms Television in common areas Skydiving Nearby Arcade/game room Health club Spa treatment room(s) Garden Free newspapers in lobby Full-service spa Wedding services Water skiing on site Fishing on site Windsurfing on site Boat tours on site Luggage storage Billiards or pool table Business center 24-hour front desk Library Playground on site Spa services on site Outdoor seasonal pool Safe-deposit box at front desk Snack bar/deli Children's pool Sauna Dry cleaning/laundry service Beach volleyball on site Airport transportation Limo or Town Car service available Free WiFi Number of bars/lounges - 1 Designated smoking areas Number of spa tubs - 1 Number of poolside bars - 1 Number of beach bars - 1 In-room accessibility (in select rooms) Roll-in shower (in select rooms) Tours/ticket assistance Accessible bathroom (in select rooms) Sailing on site Scuba diving on site Airport transportation (surcharge) On private beach Multilingual staff Breakfast available (surcharge) Turkish bath/Hammam Coffee/tea in common areas Laundry facilities elevator Fitness facilities Snorkeling on site Children's club (surcharge) Wheelchair accessible (may have limitations)","971-45-678888","71607","images/anantara.jpg"
"16","Dubai","Fairmont Dubai","FiveStar","Sheikh Zayed Road P.O. Box 97555 ","475","Distances are displayed to the nearest 0.1 mile and kilometer. <br /> <p>Dubai World Trade Centre - 1.1 km / 0.7 mi <br /> Dubai International Convention and Exhibition Centre - 1.4 km / 0.9 mi <br /> Museum of the Future - 1.4 km / 0.9 mi <br /> Dubai International Financial Centre - 1.7 km / 1.1 mi <br /> Dubai Garden Glow - 2.2 km / 1.3 mi <br /> Zabeel Park - 2.3 km / 1.5 mi <br /> Al Hudaiba Park - 2.5 km / 1.5 mi <br /> Iranian Mosque - 2.5 km / 1.5 mi <br /> Jumeirah Mosque - 3 km / 1.8 mi <br /> Dubai Frame - 3 km / 1.9 mi <br /> City Walk - 3.4 km / 2.1 mi <br /> La Mer North Beach - 3.5 km / 2.2 mi <br /> La Mer - 3.8 km / 2.3 mi <br /> Dubai Aquarium & Underwater Zoo - 3.9 km / 2.4 mi <br /> BurJuman Mall - 3.9 km / 2.4 mi <br /> </p><p>The nearest airports are:<br />Dubai Intl. Airport (DXB) - 10.3 km / 6.4 mi<br /> Sharjah (SHJ-Sharjah Intl.) - 36.6 km / 22.7 mi<br /> Al Maktoum Intl. Airport (DWC) - 58.1 km / 36.1 mi<br /> </p><p></p>","<p>HeadLine : Near Museum of the Future</p><p>Location : With a stay at Fairmont Dubai, you ll be centrally located in Dubai, a 3-minute drive from Dubai World Trade Centre and 6 minutes from Dubai Mall.  This 5-star hotel is 2.9 mi (4.7 km) from Burj Khalifa and 2.6 mi (4.2 km) from Dubai Aquarium & Underwater Zoo.</p><p>Rooms : Make yourself at home in one of the 394 guestrooms featuring minibars and LCD televisions. Wired and wireless Internet access is complimentary, while 42-inch Smart televisions with satellite programming provide entertainment. Private bathrooms with separate bathtubs and showers feature deep soaking bathtubs and designer toiletries. Conveniences include laptop-compatible safes and desks, as well as phones with free local calls.</p><p>Dining : Enjoy Turkish cuisine at Dokuz, one of the hotel s 12 restaurants, or stay in and take advantage of the 24-hour room service. Snacks are also available at the 2 coffee shops/cafes. Relax with a refreshing drink from the bar/lounge or one of the 2 poolside bars. Full breakfasts are available daily from 6:30 AM to 11:30 AM for a fee.</p><p>CheckIn Instructions : <ul>  <li>Extra-person charges may apply and vary depending on property policy</li><li>Government-issued photo identification and a credit card, debit card, or cash deposit may be required at check-in for incidental charges</li><li>Special requests are subject to availability upon check-in and may incur additional charges; special requests cannot be guaranteed</li><li>This property accepts credit cards, debit cards, and cash</li><li>Safety features at this property include a carbon monoxide detector, a fire extinguisher, a smoke detector, a security system, a first aid kit, and window guards</li><li>Please note that cultural norms and guest policies may differ by country and by property; the policies listed are provided by the property</li>  </ul></p><p>Special Instructions : This property offers transfers from the airport (surcharges may apply). Guests must contact the property with arrival details before travel, using the contact information on the booking confirmation. To make arrangements for check-in please contact the property ahead of time using the information on the booking confirmation. If you are planning to arrive after midnight please contact the property in advance using the information on the booking confirmation. Guests planning to arrive outside of normal check-in hours must contact the property in advance for check-in instructions. Front desk staff will greet guests on arrival. For more details, please contact the property using the information on the booking confirmation.  Guests must follow local laws and visitor policies.</p>","971-4-3324555","Gift shops or newsstand Dry cleaning/laundry service Sauna Steam room Free self parking Conference space Shopping on site Free valet parking Proposal/romance packages available Hair salon Babysitting or childcare (surcharge) Pool umbrellas Conference space size (meters) - 1043 Free wired Internet Limo or Town Car service available Computer station ATM/banking Wheelchair accessible path of travel Pool sun loungers Conference space size (feet) - 11227 Concierge services Free WiFi Number of bars/lounges - 1 Number of spa tubs - 2 Number of poolside bars - 2 Braille or raised signage Number of outdoor pools - 2 Assistive listening devices available Water skiing nearby In-room accessibility (in select rooms) Wheelchair accessible parking Tours/ticket assistance Accessible bathroom (in select rooms) Free shopping center shuttle Airport transportation (surcharge) Golf lessons available nearby Multilingual staff Conference center Breakfast available (surcharge) Turkish bath/Hammam Coffee/tea in common areas Number of coffee shops/cafes - 2 Laundry facilities elevator Fitness facilities Reception hall Express check-in Meeting rooms Skydiving Nearby Health club Spa treatment room(s) Free newspapers in lobby Full-service spa Wedding services Free area shuttle Couples/private dining Luggage storage Express check-out Porter/bellhop Business center 24-hour front desk Library Golfing nearby Spa services on site Safe-deposit box at front desk Smoke-free property Snack bar/deli Children's pool","971-4-3325555","97555","images/fairmont.jpg"
