"hotel_id","city_name","name","rating","location","price_per_night","attractions","description","fax_number","hotel_facilities","phone_number","pincode","image_url"
"22","Fujairah","Le Meridien Al Aqah Beach Resort","FiveStar","Dibba Road Po Box 3070 Dibba RoadFujairah ","765","Distances are displayed to the nearest 0.1 mile and kilometer. <br /> <p>Wadi Stone Village - 6.6 km / 4.1 mi <br /> Al Badia Mosque - 9.3 km / 5.8 mi <br /> Dibba Pot Roundabout - 15.4 km / 9.6 mi <br /> Khor Fakkan Beach - 17.2 km / 10.7 mi <br /> Sambraid Beach Park - 17.7 km / 11 mi <br /> Fish Market - 20.2 km / 12.6 mi <br /> Dibba Exhibition Centre - 26.1 km / 16.2 mi <br /> Oman Fjords - 38.5 km / 23.9 mi <br /> Port of Fujairah - 43.4 km / 27 mi <br /> Fujairah Museum - 46.1 km / 28.6 mi <br /> Madhab Sulpheric Spring Park - 47.1 km / 29.3 mi <br /> Dibba Society for Culture Arts and Theatre - 47.2 km / 29.3 mi <br /> Al Hayl Castle - 47.2 km / 29.3 mi <br /> Sheikh Zayed Mosque - 47.3 km / 29.4 mi <br /> Lulu Hypermarket - 47.6 km / 29.6 mi <br /> </p><p>The nearest airports are:<br />Dubai Intl. Airport (DXB) - 148.6 km / 92.3 mi<br /> Ras al Khaimah (RKT-Ras al Khaimah Intl.) - 71.1 km / 44.2 mi<br /> </p><p>The preferred airport for Le Meridien Al Aqah Beach Resort is Dubai Intl. Airport (DXB). </p>","<p>HeadLine : By the ocean</p><p>Location : With a stay at Le Meridien Al Aqah Beach Resort in Al Aqah, you ll be 5.8 mi (9.3 km) from Al Badia Mosque and 10.7 mi (17.2 km) from Khor Fakkan Beach.  This 5-star hotel is 4.1 mi (6.6 km) from Wadi Stone Village and 9.6 mi (15.4 km) from Dibba Pot Roundabout.</p><p>Rooms : Make yourself at home in one of the 218 air-conditioned rooms featuring iPod docking stations and minibars. Your pillowtop bed comes with premium bedding. LED televisions with cable programming provide entertainment, while complimentary wireless Internet access keeps you connected. Private bathrooms with separate bathtubs and showers feature designer toiletries and bidets.</p><p>Dining : All-inclusive rates are available at this hotel. Meals and beverages at onsite dining establishments are included in all-inclusive rates. Charges may be applied for dining at some restaurants, special dinners and dishes, some beverages, and other amenities. <p>Enjoy a meal at the restaurant, or stay in and take advantage of the hotel s 24-hour room service. Wrap up your day with a drink at the bar/lounge, the beach bar, or the poolside bar. Buffet breakfasts are served on weekdays from 7:00 AM to 10:30 AM and on weekends from 7:00 AM to 11:00 AM for a fee. </p></p><p>CheckIn Instructions : <ul>  <li>Extra-person charges may apply and vary depending on property policy</li><li>Government-issued photo identification and a credit card, debit card, or cash deposit may be required at check-in for incidental charges</li><li>Special requests are subject to availability upon check-in and may incur additional charges; special requests cannot be guaranteed</li><li>The name on the credit card used at check-in to pay for incidentals must be the primary name on the guestroom reservation</li><li>This property accepts credit cards, debit cards, and cash</li>  </ul></p><p>Special Instructions : Front desk staff will greet guests on arrival.</p>","971-9-204 41 40","Wheelchair-accessible registration desk Wheelchair-accessible fitness center Wheelchair-accessible pool Arcade/game room Garden Picnic area Wedding services Beach towels 24-hour fitness facilities Fishing on site Miniature golf on site Luggage storage Express check-out Porter/bellhop Babysitting or childcare (surcharge) Free WiFi Number of bars/lounges - 1 Number of spa tubs - 1 Number of poolside bars - 1 Number of outdoor pools - 2 Number of beach bars - 1 Number of swim-up bars - 1 In-room accessibility (in select rooms) Roll-in shower (in select rooms) Tours/ticket assistance Accessible bathroom (in select rooms) Wheelchair-accessible lounge Wheelchair-accessible on-site restaurant Outdoor tennis courts - 3 Visual alarms in hallways Multilingual staff Electric car charging station Breakfast available (surcharge) Wheelchair-accessible meeting spaces/business center Laundry facilities elevator Children's club (free) Fitness facilities Supervised childcare/activities (free) Bicycle rentals on site Banquet hall Ballroom Wheelchair-accessible concierge desk Reception hall Express check-in Wheelchair-accessible path to elevator Valet for wheelchair-equipped vehicle Wheelchair-accessible spa Computer station Beach sun loungers Wheelchair accessible path of travel Pool sun loungers Conference space size (feet) - 4840 24-hour business center Business center 24-hour front desk Playground on site Racquetball/squash on site Rowing or canoeing on site Kayaking on site Hair salon Tennis on site Motor boating on site Terrace ATM/banking Concierge services Gift shops or newsstand Dry cleaning/laundry service Beach volleyball on site Shopping on site Newspapers in lobby (surcharge) Pool umbrellas Number of meeting rooms - 8 Conference space size (meters) - 450 Swimming pool Limo or Town Car service available Fitness classes on site Scuba diving on site On private beach Snorkeling on site Surfing/bodyboarding on site Wheelchair accessible (may have limitations) Beach umbrellas Health club Spa treatment room(s) Full-service spa Tennis lessons on site Volleyball on site Water skiing on site Yoga classes/instruction on site Rock climbing on site Spa services on site Safe-deposit box at front desk Smoke-free property Hiking/biking trails nearby Children's pool Sauna Steam room Free self parking Conference space Free valet parking","97192449000","0","images/le meridien.jpg"
"23","Ras al Khaimah","DoubleTree by Hilton Resort & Spa Marjan Island","FiveStar","Marjan Island Boulevard  ","536","Distances are displayed to the nearest 0.1 mile and kilometer. <br /> <p>Saqr Park - 7.1 km / 4.4 mi <br /> Al Hamra Mall - 7.5 km / 4.6 mi <br /> Al Hamra Golf Club - 7.9 km / 4.9 mi <br /> Al Hamra Marina and Yacht Club - 11.9 km / 7.4 mi <br /> Dreamland - 13.9 km / 8.6 mi <br /> Khuzam Family Park - 25.3 km / 15.7 mi <br /> Jungle Bungle - 26.2 km / 16.3 mi <br /> Al Qawasim Corniche - 26.3 km / 16.3 mi <br /> RAK Pearls Museum - 26.4 km / 16.4 mi <br /> National Museum of Ras al Khaimah - 27.9 km / 17.3 mi <br /> Jazirat Al Hamra Fishing Village - 28.5 km / 17.7 mi <br /> Tower Links Golf Club - 29 km / 18 mi <br /> Fun City - 29.9 km / 18.6 mi <br /> Al Manar Mall - 29.9 km / 18.6 mi <br /> Umm Al Quwain- Beach - 37.6 km / 23.3 mi <br /> </p><p>The nearest airports are:<br />Dubai Intl. Airport (DXB) - 83.7 km / 52 mi<br /> Ras al Khaimah (RKT-Ras al Khaimah Intl.) - 43.3 km / 26.9 mi<br /> Sharjah (SHJ-Sharjah Intl.) - 70.6 km / 43.9 mi<br /> </p><p>The preferred airport for DoubleTree by Hilton Resort & Spa Marjan Island is Dubai Intl. Airport (DXB). </p>","<p>HeadLine : Near Al Hamra Mall</p><p>Location : Located in Ras Al Khaimah, DoubleTree by Hilton Resort & Spa Marjan Island is on the boardwalk, within a 10-minute drive of Saqr Park and Al Hamra Mall.  This 5-star hotel is 4.9 mi (7.9 km) from Al Hamra Golf Club and 7.4 mi (11.9 km) from Al Hamra Marina and Yacht Club.</p><p>Rooms : Make yourself at home in one of the 723 air-conditioned rooms featuring refrigerators and MP3 docking stations. Rooms have private balconies or patios. Complimentary wireless Internet access keeps you connected, and 42-inch flat-screen televisions are provided for your entertainment. Private bathrooms with showers feature complimentary toiletries and bidets.</p><p>Dining : All-inclusive rates are available at this hotel. Meals and beverages at onsite dining establishments are included in all-inclusive rates. Charges may be applied for dining at some restaurants, special dinners and dishes, some beverages, and other amenities. <p>Grab a bite at Sho Fee Rooftop lounge, one of the hotel s 14 restaurants, or stay in and take advantage of the 24-hour room service. Snacks are also available at the 2 coffee shops/cafes. Wind down with a drink at one of the 2 bars/lounges or 2 poolside bars. Buffet breakfasts are available daily from 6:30 AM to 11 AM for a fee. </p></p><p>CheckIn Instructions : <ul>  <li>Extra-person charges may apply and vary depending on property policy</li><li>Government-issued photo identification and a credit card, debit card, or cash deposit may be required at check-in for incidental charges</li><li>Special requests are subject to availability upon check-in and may incur additional charges; special requests cannot be guaranteed</li><li>This property accepts credit cards, debit cards, and cash</li><li>Safety features at this property include a fire extinguisher, a smoke detector, a security system, and a first aid kit</li><li>Some rooms at this property are not suitable for children; please add child ages in the search parameters to display available rooms</li>  </ul></p><p>Special Instructions : This property offers transfers from the airport (surcharges may apply). To arrange pick-up, guests must contact the property 72 hours prior to arrival, using the contact information on the booking confirmation. Front desk staff will greet guests on arrival.</p>","971-7-2030003","Visual alarms in hallways Multilingual staff Conference center Breakfast available (surcharge) Wheelchair-accessible meeting spaces/business center Number of coffee shops/cafes - 2 Laundry facilities elevator Babysitting or childcare (surcharge) Scuba diving nearby Free WiFi Number of bars/lounges - 2 Number of poolside bars - 2 Number of outdoor pools - 7 Number of indoor pools - 1 In-room accessibility (in select rooms) Wheelchair accessible parking Roll-in shower (in select rooms) Tours/ticket assistance Accessible bathroom (in select rooms) Shopping center shuttle (surcharge) Rooftop terrace Wheelchair-accessible lounge Wheelchair-accessible on-site restaurant Outdoor tennis courts - 1 Children's club (free) Fitness facilities Supervised childcare/activities (free) Banquet hall Free grocery shopping service Ballroom Wheelchair-accessible concierge desk Wheelchair-accessible van parking Wheelchair-accessible path to elevator Valet for wheelchair-equipped vehicle Wheelchair-accessible registration desk Wheelchair-accessible fitness center Wheelchair-accessible public washroom Arcade/game room Well-lit path to entrance Garden Stair-free path to entrance Free newspapers in lobby Wedding services Beach towels Boat tours on site Luggage storage Business center 24-hour front desk Playground on site Rowing or canoeing on site Kayaking on site Hair salon Access to nearby indoor pool Motor boating on site Terrace ATM/banking Parasailing on site Concierge services Gift shops or newsstand Dry cleaning/laundry service Beach volleyball on site Shopping on site Airport transportation Pool umbrellas Number of meeting rooms - 3 Conference space size (meters) - 327 Swimming pool Airport transportation (surcharge) On private beach Golf lessons available nearby Turkish bath/Hammam Surfing/bodyboarding on site Wheelchair accessible (may have limitations) Beach umbrellas Nightclub Health club Spa treatment room(s) Full-service spa Volleyball on site Water skiing on site Windsurfing on site Free area shuttle Grocery/convenience store Billiards or pool table Golfing nearby Spa services on site Snorkeling nearby Safe-deposit box at front desk Smoke-free property Snack bar/deli Children's pool Sauna Steam room Free self parking Free beach cabanas Conference space Waterslide Free valet parking Free pool cabanas Computer station Beach sun loungers Wheelchair accessible path of travel Pool sun loungers Conference space size (feet) - 3520 24-hour business center","97172030000","14800","images/doubletree.jpg"
"24","Ras al Khaimah","Hilton Ras Al Khaimah Beach Resort","FiveStar","Al Maareedh Street PO Box 12298 PO Box 12298Ras Al Khaimah ","134","Distances are displayed to the nearest 0.1 mile and kilometer. <br /> <p>Fun City - 4.6 km / 2.9 mi <br /> Al Manar Mall - 4.8 km / 3 mi <br /> Jazirat Al Hamra Fishing Village - 7.1 km / 4.4 mi <br /> National Museum of Ras al Khaimah - 7.4 km / 4.6 mi <br /> Tower Links Golf Club - 8.6 km / 5.3 mi <br /> Khuzam Family Park - 10 km / 6.2 mi <br /> RAK Pearls Museum - 10.4 km / 6.4 mi <br /> Al Qawasim Corniche - 10.5 km / 6.6 mi <br /> Jungle Bungle - 12.3 km / 7.6 mi <br /> Dhayan Fort - 16.2 km / 10 mi <br /> Al Hamra Mall - 28.2 km / 17.5 mi <br /> Al Hamra Marina and Yacht Club - 29 km / 18 mi <br /> Al Hamra Golf Club - 29.1 km / 18.1 mi <br /> Saqr Park - 31.5 km / 19.6 mi <br /> Khatt Hot Springs - 35.2 km / 21.8 mi <br /> </p><p>The nearest airports are:<br />Ras al Khaimah (RKT-Ras al Khaimah Intl.) - 25.9 km / 16.1 mi<br /> Khasab (KHS) - 98.9 km / 61.4 mi<br /> </p><p></p>","<p>HeadLine : Near Fun City</p><p>Location : Located in Ras Al Khaimah, Hilton Ras Al Khaimah Beach Resort is by the ocean, within a 10-minute drive of Fun City and Al Manar Mall.  This 5-star hotel is 4.4 mi (7.1 km) from Jazirat Al Hamra Fishing Village and 4.6 mi (7.4 km) from National Museum of Ras al Khaimah.</p><p>Rooms : Make yourself at home in one of the 471 air-conditioned guestrooms. Complimentary wireless Internet access keeps you connected, and satellite programming is available for your entertainment. Private bathrooms with separate bathtubs and showers feature designer toiletries and bidets. Conveniences include phones, as well as laptop-compatible safes and desks.</p><p>Dining : All-inclusive rates are available at this hotel. Meals and beverages at onsite dining establishments are included in all-inclusive rates. Charges may be applied for dining at some restaurants, special dinners and dishes, some beverages, and other amenities. <p>Enjoy Mediterranean cuisine at SOL Beach Lounge & Bar, one of the hotel s 3 restaurants, or stay in and take advantage of the 24-hour room service. Snacks are also available at the coffee shop/cafe. Wind down with a drink at one of the 3 bars/lounges or 3 beach bars. Buffet breakfasts are available daily from 7 AM to 11:00 AM for a fee. </p></p><p>CheckIn Instructions : <ul>  <li>Extra-person charges may apply and vary depending on property policy</li><li>Government-issued photo identification and a credit card, debit card, or cash deposit may be required at check-in for incidental charges</li><li>Special requests are subject to availability upon check-in and may incur additional charges; special requests cannot be guaranteed</li><li>Guests must contact this property in advance to reserve cribs/infant beds, rollaway/extra beds, and sofa beds</li><li>This property accepts credit cards, debit cards, and cash</li><li>Safety features at this property include a carbon monoxide detector, a fire extinguisher, a smoke detector, a security system, a first aid kit, and window guards</li><li>Please note that cultural norms and guest policies may differ by country and by property; the policies listed are provided by the property</li>  </ul></p><p>Special Instructions : This property offers transfers from the airport (surcharges may apply). Guests must contact the property with arrival details before travel, using the contact information on the booking confirmation. Front desk staff will greet guests on arrival.  The half board and full board rate plans do not include beverages. Guests booked in these rate plans receive meals at The Kitchen restaurant.</p>","971-7-2260022","Multilingual staff Handrails in stairways Electric car charging station Breakfast available (surcharge) Turkish bath/Hammam Number of coffee shops/cafes - 1 Laundry facilities elevator Children's club (free) Fitness facilities Supervised childcare/activities (free) Surfing/bodyboarding on site Banquet hall Wheelchair accessible (may have limitations) Free grocery shopping service Wheelchair-accessible concierge desk Beach umbrellas Express check-in Wheelchair-accessible path to elevator Wheelchair-accessible spa Arcade/game room Spa treatment room(s) Well-lit path to entrance Garden Stair-free path to entrance Free newspapers in lobby Full-service spa Wedding services Gift shops or newsstand Dry cleaning/laundry service Beach volleyball on site Shopping on site Ziplining nearby Pool umbrellas Number of meeting rooms - 3 Conference space size (meters) - 241 Swimming pool Sailing nearby Free WiFi Number of bars/lounges - 3 Designated smoking areas Number of outdoor pools - 6 Number of beach bars - 3 Wheelchair accessible parking Tours/ticket assistance Fitness classes on site Airport transportation (surcharge) On private beach Wheelchair-accessible on-site restaurant Free self parking Free beach cabanas Conference space Waterslide Kayaking on site Free pool cabanas Hair salon Motor boating on site Beach sun loungers Terrace Access to nearby outdoor pool Pool sun loungers Conference space size (feet) - 2592 Parasailing on site Concierge services Luggage storage Express check-out Grocery/convenience store Porter/bellhop Personal motorized watercraft on site 24-hour front desk Lifeguard on site Playground on site Spa services on site Snorkeling nearby Safe-deposit box at front desk Children's pool Sauna Steam room Beach towels Water skiing on site 24-hour fitness facilities Fishing on site Windsurfing on site Boat tours on site Yoga classes/instruction on site Couples/private dining","97172288844","11133","images/hilton beach.jpg"
"25","Ras al Khaimah","Waldorf Astoria Ras Al Khaimah","FiveStar","Vienna Street Ras Al Khaimah ","1693","Distances are displayed to the nearest 0.1 mile and kilometer. <br /> <p>Al Hamra Golf Club - 0.7 km / 0.4 mi <br /> Al Hamra Mall - 1.3 km / 0.8 mi <br /> Saqr Park - 2.4 km / 1.5 mi <br /> Al Hamra Marina and Yacht Club - 4.9 km / 3.1 mi <br /> Dreamland - 17 km / 10.5 mi <br /> Khuzam Family Park - 22.1 km / 13.7 mi <br /> Jungle Bungle - 23 km / 14.3 mi <br /> Al Qawasim Corniche - 23.1 km / 14.3 mi <br /> RAK Pearls Museum - 23.2 km / 14.4 mi <br /> National Museum of Ras al Khaimah - 24.7 km / 15.3 mi <br /> Jazirat Al Hamra Fishing Village - 25.2 km / 15.7 mi <br /> Tower Links Golf Club - 25.7 km / 16 mi <br /> Fun City - 26.6 km / 16.5 mi <br /> Al Manar Mall - 26.7 km / 16.6 mi <br /> Umm Al Quwain- Beach - 40.6 km / 25.2 mi <br /> </p><p>The nearest airports are:<br />Dubai Intl. Airport (DXB) - 80.5 km / 50 mi<br /> Ras al Khaimah (RKT-Ras al Khaimah Intl.) - 40 km / 24.9 mi<br /> Sharjah (SHJ-Sharjah Intl.) - 67.2 km / 41.8 mi<br /> </p><p>The preferred airport for Waldorf Astoria Ras Al Khaimah is Dubai Intl. Airport (DXB). </p>","<p>HeadLine : Near Al Hamra Mall</p><p>Location : With a stay at Waldorf Astoria Ras Al Khaimah in Ras Al Khaimah, you ll be next to a golf course and 8 minutes by foot from Al Hamra Golf Club.  This 5-star hotel is 1 mi (1.6 km) from Al Hamra Mall and 2.4 mi (3.8 km) from Saqr Park.</p><p>Rooms : Make yourself at home in one of the 346 guestrooms featuring minibars and LCD televisions. Complimentary wireless Internet access keeps you connected, and satellite programming is available for your entertainment. Bathrooms with separate bathtubs and showers feature deep soaking bathtubs and designer toiletries. Conveniences include phones, as well as laptop-compatible safes and desks.</p><p>Dining : Enjoy American cuisine at Sunset Beach Club & Loung, a poolside bar/lounge which features a pool view. You can also stay in and take advantage of the 24-hour room service. When you are in need of a refreshing drink, visit the swim-up bar or one of 2 beach bars, or 2 poolside bars. Cooked-to-order breakfasts are available daily from 7 AM to 11 AM for a fee.</p><p>Renovations : This property is closed from July 1 2023 to September 30 2023 (dates subject to change).   This property will be closed from July 1 2023 to September 30 2023 for renovations and will resume operation once the renovation is complete (completion date subject to change).  The following facilities are closed on New Year s Eve: <ul><li>Bar/lounge</li><li>Dining venue(s)</li><li>Swimming pool</li></ul> &nbsp;</p><p>CheckIn Instructions : <ul>  <li>Extra-person charges may apply and vary depending on property policy</li><li>Government-issued photo identification and a credit card, debit card, or cash deposit may be required at check-in for incidental charges</li><li>Special requests are subject to availability upon check-in and may incur additional charges; special requests cannot be guaranteed</li><li>This property accepts credit cards, debit cards, and cash</li><li>Safety features at this property include a carbon monoxide detector, a fire extinguisher, a smoke detector, a security system, a first aid kit, and window guards</li><li>Please note that cultural norms and guest policies may differ by country and by property; the policies listed are provided by the property</li>  </ul> <ul>  <li>All guests are required to show a Passport or Emirates ID upon check in.</li><li>Meals are included for 1 child 12 years and younger</li>  </ul></p><p>Special Instructions : This property offers transfers from the airport (surcharges may apply). To arrange pick-up, guests must contact the property 24 hours prior to arrival, using the contact information on the booking confirmation. Front desk staff will greet guests on arrival. For more details, please contact the property using the information on the booking confirmation.</p>","971-72-035566","Fitness classes on site Airport transportation (surcharge) On private beach Wheelchair-accessible lounge Wheelchair-accessible on-site restaurant Outdoor tennis courts - 2 Horse riding nearby Multilingual staff Handrails in hallways Conference center Breakfast available (surcharge) Wheelchair-accessible meeting spaces/business center Coffee/tea in common areas Number of coffee shops/cafes - 1 Gift shops or newsstand Dry cleaning/laundry service Shopping on site Beach yoga on site Babysitting or childcare (surcharge) Ziplining nearby Pool umbrellas Number of meeting rooms - 8 Swimming pool Limo or Town Car service available Free WiFi Number of bars/lounges - 1 Number of spa tubs - 1 Number of poolside bars - 2 Number of outdoor pools - 2 Number of beach bars - 2 Number of swim-up bars - 1 In-room accessibility (in select rooms) Wheelchair accessible parking Roll-in shower (in select rooms) Tours/ticket assistance Accessible bathroom (in select rooms) Airport transportation - pickup (surcharge) Porter/bellhop Business center Laundry facilities elevator Children's club (free) Fitness facilities Bicycle rentals on site Wheelchair accessible (may have limitations) Wheelchair-accessible concierge desk Beach umbrellas Reception hall Express check-in Wheelchair-accessible path to elevator Wheelchair-accessible registration desk Television in common areas Wheelchair-accessible fitness center Wheelchair-accessible pool Golfing on site Wheelchair-accessible public washroom Well-lit path to entrance Garden Picnic area Stair-free path to entrance Full-service spa Wedding services Beach towels 24-hour fitness facilities Supervised childcare/activities (surcharge) Golf driving range on site Free beach shuttle Golf lessons on site Rock climbing nearby Luggage storage Express check-out Grocery/convenience store 24-hour front desk Library Playground on site Spa services on site Safe-deposit box at front desk Smoke-free property Snack bar/deli Children's pool Sauna Steam room Free self parking Free valet parking Hair salon Tennis on site Computer station Beach sun loungers Terrace ATM/banking Wheelchair accessible path of travel Golf course on site Pool sun loungers Concierge services","97172035555","99999","images/waldorf.jpg"
