"hotel_id","city_name","name","rating","location","price_per_night","attractions","description","fax_number","hotel_facilities","phone_number","pincode","image_url"
"27","Ras al Khaimah","Citymax Hotel Ras Al Khaimah","ThreeStar","Bin Daher Street Ras Al Khaimah  ","122","Distances are displayed to the nearest 0.1 mile and kilometer. <br /> <p>Al Manar Mall - 0.8 km / 0.5 mi <br /> Fun City - 0.8 km / 0.5 mi <br /> Jazirat Al Hamra Fishing Village - 2.6 km / 1.6 mi <br /> National Museum of Ras al Khaimah - 3 km / 1.9 mi <br /> Al Qawasim Corniche - 4.2 km / 2.6 mi <br /> Tower Links Golf Club - 4.3 km / 2.6 mi <br /> RAK Pearls Museum - 4.3 km / 2.7 mi <br /> Khuzam Family Park - 6.1 km / 3.8 mi <br /> Jungle Bungle - 8.4 km / 5.2 mi <br /> Dhayan Fort - 16.6 km / 10.3 mi <br /> Al Hamra Mall - 24.2 km / 15 mi <br /> Al Hamra Marina and Yacht Club - 24.4 km / 15.2 mi <br /> Al Hamra Golf Club - 25.2 km / 15.6 mi <br /> Saqr Park - 27.6 km / 17.1 mi <br /> Khatt Hot Springs - 28.8 km / 17.9 mi <br /> </p><p>The nearest airports are:<br />Ras al Khaimah (RKT-Ras al Khaimah Intl.) - 22.1 km / 13.7 mi<br /> Khasab (KHS) - 97.1 km / 60.3 mi<br /> </p><p></p>","<p>HeadLine : Near Fun City</p><p>Location : With a stay at Citymax Hotel Ras Al Khaimah in Ras Al Khaimah, you ll be within a 10-minute walk of Al Manar Mall and Fun City.  This hotel is 1.6 mi (2.6 km) from Jazirat Al Hamra Fishing Village and 1.8 mi (3 km) from National Museum of Ras al Khaimah.</p><p>Rooms : Make yourself at home in one of the 204 air-conditioned rooms featuring refrigerators and flat-screen televisions. Complimentary wireless Internet access is available to keep you connected. Bathrooms feature bathtubs or showers, complimentary toiletries, and hair dryers. Conveniences include phones, as well as safes and desks.</p><p>Dining : Grab a bite at City Cafe, one of the hotel s 2 restaurants, or stay in and take advantage of the 24-hour room service. Unwind at the end of the day with a drink at the bar/lounge or the poolside bar. Buffet breakfasts are available daily from 6:30 AM to 10:30 AM for a fee.</p><p>CheckIn Instructions : <ul>  <li>Extra-person charges may apply and vary depending on property policy</li><li>Government-issued photo identification and a credit card, debit card, or cash deposit may be required at check-in for incidental charges</li><li>Special requests are subject to availability upon check-in and may incur additional charges; special requests cannot be guaranteed</li><li>This property accepts credit cards, debit cards, and cash</li><li>Safety features at this property include a fire extinguisher, a smoke detector, a security system, and a first aid kit</li><li>Please note that cultural norms and guest policies may differ by country and by property; the policies listed are provided by the property</li>  </ul></p><p>Special Instructions : Front desk staff will greet guests on arrival.  All guests must show a valid passport. This is the only identification that is accepted at this property.</p>","971-4-3252969","Dry cleaning/laundry service Free WiFi Number of bars/lounges - 1 Designated smoking areas Number of poolside bars - 1 Number of outdoor pools - 1 In-room accessibility (in select rooms) Wheelchair accessible parking Tours/ticket assistance Accessible bathroom (in select rooms) Area shuttle (surcharge) Rooftop terrace Luggage storage Business center 24-hour front desk Breakfast available (surcharge) Safe-deposit box at front desk Laundry facilities elevator Free self parking Fitness facilities Terrace Wheelchair accessible path of travel Concierge services","971-0-564162863","116121","images/citymax.jpg"
"28","Sharjah","Copthorne Hotel Sharjah","FourStar","Al Majaz 3 Buheira Corniche Road Corniche RoadP.O. Box 39887Sharjah ","174","Distances are displayed to the nearest 0.1 mile and kilometer. <br /> <p>Khalid Lake - 0.1 km / 0.1 mi <br /> Al Jazeera Park - 1.2 km / 0.8 mi <br /> Flag Island - 1.7 km / 1 mi <br /> Al Majaz Park - 2 km / 1.3 mi <br /> Sharjah Gold Souq - 2 km / 1.3 mi <br /> Al Majaz Waterfront - 2.1 km / 1.3 mi <br /> Sharjah Aquarium - 2.8 km / 1.7 mi <br /> Sharjah City Centre - 3 km / 1.9 mi <br /> Al Noor Mosque - 3.1 km / 1.9 mi <br /> Expo Centre Sharjah - 3.1 km / 1.9 mi <br /> Rolla Mall - 3.4 km / 2.1 mi <br /> Port Khalid - 3.5 km / 2.2 mi <br /> Safeer Mall - 3.8 km / 2.4 mi <br /> Sharjah Mega Mall - 4 km / 2.5 mi <br /> Sharjah Gold Center - 4.8 km / 3 mi <br /> </p><p>The nearest airports are:<br />Dubai Intl. Airport (DXB) - 13.9 km / 8.7 mi<br /> Sharjah (SHJ-Sharjah Intl.) - 20 km / 12.4 mi<br /> </p><p>The preferred airport for Copthorne Hotel Sharjah is Sharjah (SHJ-Sharjah Intl.). </p>","<p>HeadLine : In Sharjah (Al Majaz)</p><p>Location : A stay at Copthorne Hotel Sharjah places you in the heart of Sharjah, steps from Khalid Lake and a 3-minute drive from Flag Island.  This 4-star hotel is 1.9 mi (3 km) from Sharjah Aquarium and 2.6 mi (4.1 km) from Al Noor Mosque.</p><p>Rooms : Make yourself at home in one of the 255 individually decorated guestrooms, featuring refrigerators and LCD televisions. Your pillowtop bed comes with Egyptian cotton sheets. Complimentary wired and wireless Internet access keeps you connected, and satellite programming provides entertainment. Bathrooms with shower/tub combinations feature deep soaking bathtubs and designer toiletries.</p><p>Dining : Enjoy international cuisine at The Lagoon (International, one of the hotel s 3 restaurants, or stay in and take advantage of the 24-hour room service. Snacks are also available at the coffee shop/cafe. Buffet breakfasts are available daily from 6:30 AM to 10:30 AM for a fee.</p><p>CheckIn Instructions : <ul>  <li>Extra-person charges may apply and vary depending on property policy</li><li>Government-issued photo identification and a credit card, debit card, or cash deposit may be required at check-in for incidental charges</li><li>Special requests are subject to availability upon check-in and may incur additional charges; special requests cannot be guaranteed</li><li>The name on the credit card used at check-in to pay for incidentals must be the primary name on the guestroom reservation</li><li>This property accepts credit cards; cash is not accepted</li><li>This property uses solar energy, plus a grey water recycling system and eco-friendly cleaning products</li><li>Safety features at this property include a fire extinguisher, a smoke detector, a security system, a first aid kit, and window guards</li><li>Please note that cultural norms and guest policies may differ by country and by property; the policies listed are provided by the property</li>  </ul></p><p>Special Instructions : This property offers transfers from the airport (surcharges may apply). To arrange pick-up, guests must contact the property 24 hours prior to arrival, using the contact information on the booking confirmation. Front desk staff will greet guests on arrival.</p>","971-65-930674","Free valet parking Computer station Wheelchair accessible path of travel Concierge services Airport transportation - drop-off (surcharge) Free shopping center shuttle Eco-friendly toiletries Eco-friendly cleaning products provided Recycling LED light bulbs Reusable coffee/tea filters Multilingual staff Conference center Water dispenser Gift shops or newsstand Dry cleaning/laundry service Renewable energy source - solar Grey water recycling system Eco-friendly cleaning products used Bicycle on site Bicycle-friendly property Free WiFi Designated smoking areas Number of outdoor pools - 1 Assistive listening devices available In-room accessibility (in select rooms) Wheelchair accessible parking Roll-in shower (in select rooms) Tours/ticket assistance Accessible bathroom (in select rooms) Breakfast available (surcharge) Long-term parking Ecotours nearby Coffee/tea in common areas Number of coffee shops/cafes - 1 Laundry facilities elevator Meeting rooms Television in common areas Health club Free newspapers in lobby Area shuttle (surcharge) Free beach shuttle Luggage storage Express check-out Business center 24-hour front desk Safe-deposit box at front desk Snack bar/deli Free self parking","971-6-5930555","39887","images/copthorne.jpg"
"29","Sharjah","Royal Crown Suites","ThreeStar","Al Khan Road Sharjah Al MajjazP.O. Box 7085Sharjah ","134",,"In a modern 16-storey building with panoramic views over the Khaled and Al Khan Lagoons, Royal Crown Suites offers you comfortable accommodation, free parking and genuine Arabic hospitality.

This hotel is located just 1.5 km from the Expo Centre and 10 minutes’ drive from the airport. With its convenient location, modern business centre and wireless internet access, Royal Crown Suites is an ideal choice for business travellers.

The hotel is also an excellent choice if you want to explore Sharjah’s attractions and shopping centres. Just a short drive away you will find Mamzar Beach Park and Sharjah Aquarium, or take a pleasant stroll to the nearby Al Majaz Park.

Once back at the hotel you can cool down in your air-conditioned room or suite, all tastefully decorated with light colours and tiled floors. A sauna and a fitness centre are also available. Please inform Royal Crown Suites in advance of your expected arrival time. You can use the Special Requests box when booking, or contact the property directly with the contact details provided in your confirmation.
Guests are required to show a photo identification and credit card upon check-in. Please note that all Special Requests are subject to availability and additional charges may apply.","971-6-5563719","Parking Restaurant Room service Sauna Fitness centre Non-smoking rooms Laundry dry cleaning Facilities for disabled guests Family rooms VIP room facilities breakfast in the room Ironing service Free parking internet services lift Billiards Car hire wifi Indoor pool Air conditioning designated smoking area Daily housekeeping grocery deliveries On-site parking Private parking wifi available in all areas paid wifi Accessible parking Toilet with grab rails","(971) 65561333","9716","images/royal crown.jpg"
"30","Umm al Quwain","Umm Al Quwain Beach Hotel","FourStar","Beach Road P.O. Box 158Umm al-Quwain ","439",,"This 4-star hotel on the shores of Umm Al Quwain Beach is set in tropical gardens with palm trees. It offers an outdoor temperature controlled pool, an à la carte restaurant and concierge services.

The air-conditioned villas at the Umm Al Quwain Beach Hotel have an en suite bathroom. They offer a private balcony with ocean views, a refrigerator and a spacious seating area with satellite TV.

The Umm Al Quwain’s restaurant serves authentic Lebanese cuisine and offers shisha. Live music can be enjoyed on Fridays during lunch hours. Guests can also benefit from room service.

The hotel is 45 km from Dubai International Airport and a 15-minute drive from Ajman city Centre. Free private parking is available on site. Guests are required to show a photo identification and credit card upon check-in. Please note that all Special Requests are subject to availability and additional charges may apply.
A damage deposit of AED 500 is required on arrival. This will be collected by credit card. You should be reimbursed within 14 days of check-out. Your deposit will be refunded in full via credit card, subject to an inspection of the property.","00971 6 7662778","Parking Restaurant Pets allowed Room service meeting/banquet facilities Bar 24-hour front desk Garden Terrace Non-smoking rooms Airport shuttle Business centre Laundry dry cleaning Family rooms breakfast in the room Ironing service Free parking internet services Safety Deposit Box Currency exchange children's playground Canoeing Packed lunches Car hire Fax/photocopying Snorkelling Luggage storage wifi Outdoor pool Free WiFi Air conditioning Private beach area Snack Bar Sun terrace cashless payment available physical distancing rules followed mobile app for room service invoice provided property is cleaned by professional cleaning companies all plates  cutlery  glasses and other tableware have been sanitized guests have the option to cancel any cleaning services for their accommodation during their stay breakfast takeaway containers delivered food is securely covered face masks for guests available use of cleaning chemicals that are effective against coronavirus linens  towels and laundry washed in accordance with local authority guidelines guest accommodation is disinfected between stays guest accommodation sealed after cleaning physical distancing in dining areas food can be delivered to guest accommodation staff follow all safety protocols as directed by local authorities shared stationery such as printed menus  magazines  pens  and paper removed hand sanitizer in guest accommodation and key areas process in place to check health of guests first aid kit available Outdoor furniture Picnic area Swimming pool Beach Shuttle service Live sport events (broadcast) 24-hour security Key access Security alarm Smoke alarms CCTV in common areas CCTV outside property outdoor pool (all year) concierge service shuttle service (additional charge) Special diet menus (on request) Trouser press water sport facilities on site airport shuttle (additional charge) minimarket on site Beachfront Daily housekeeping parking on site Private parking wifi available in all areas Swimming pool toys kids' outdoor play equipment Kid meals secured parking Parking garage Accessible parking Pool with view Heated pool Wine/champagne Fruits airport pick up airport drop off Pet bowls coffee house on site sun loungers or beach chairs Sun umbrellas Fire extinguishers Swimming pool","97167666647","NA","images/umm al quwain.jpg"
"31","Umm al Quwain","Barracuda Beach Resort","ThreeStar","Khor Al Baida Umm Al Quwain 1311 ","436",,"Situated on the coast of the lagoon, Barracuda Resort features an outdoor swimming pool with a garden terrace. All of the air-conditioned rooms have a balcony. The resort is next door to Dreamland Aquapark which is only 1 km away.

This resort hotel includes a restaurant serving international cuisine and a coffee shop. Guests can make use of the communal barbecue terrace which hosts various evening entertainments.

The modern apartments come equipped with cable TV, a refrigerator and tea and coffee making facilities. Some have a lagoon view.

Ajman, on the edge of Dubai, is 28 km away. Barracuda Resort is 30 km south of Ras Al Khaimah. Guests are required to show a photo identification and credit card upon check-in. Please note that all Special Requests are subject to availability and additional charges may apply.
In response to Coronavirus (COVID-19), additional safety and sanitation measures are in effect at this property.
Food & beverage services at this property may be limited or unavailable due to Coronavirus (COVID-19).
Due to Coronavirus (COVID-19), this property is taking steps to help protect the safety of guests and staff. Certain services and amenities may be reduced or unavailable as a result.
Due to Coronavirus (COVID-19), this property has reduced reception and service operating hours.
In accordance with government guidelines to minimise transmission of the Coronavirus (COVID-19), this property may request additional documentation from guests to validate identity, travel itinerary and other relevant information, during dates where such guidelines exist.
A damage deposit of AED 500 is required on arrival. This will be collected as a cash payment. You should be reimbursed on check-out. Your deposit will be refunded in full in cash, subject to an inspection of the property.
As per Government Regulations no music/dancing (etc) will be allowed in the resort.

All guests have to present valid identification upon check in (Passport, UAE driving license or UAE identity card ). This also applies to the visitors of our in-house guests.","97167681556","Parking Restaurant Room service meeting/banquet facilities Bar 24-hour front desk Garden Terrace Non-smoking rooms Laundry dry cleaning Facilities for disabled guests Family rooms breakfast in the room Ironing service Free parking internet services express check-in/check-out Safety Deposit Box Currency exchange children's playground Billiards BBQ facilities Packed lunches Car hire Fax/photocopying wifi Outdoor pool Free WiFi Air conditioning outdoor pool (all year) Private check-in/check-out Special diet menus (on request) Trouser press Lockers Daily housekeeping parking on site Private parking Public Bath kids' outdoor play equipment Kid meals secured parking Accessible parking Wheelchair accessible Toilet with grab rails Emergency cord in bathroom Wine/champagne Fruits sun loungers or beach chairs Sun umbrellas Outdoor furniture Picnic area Outdoor fireplace Swimming pool Happy hour 24-hour security Security alarm Smoke alarms CCTV in common areas CCTV outside property Fire extinguishers Swimming pool use of cleaning chemicals that are effective against coronavirus linens  towels and laundry washed in accordance with local authority guidelines guest accommodation is disinfected between stays guest accommodation sealed after cleaning physical distancing in dining areas food can be delivered to guest accommodation thermometers for guests provided by property face masks for guests available staff follow all safety protocols as directed by local authorities shared stationery such as printed menus  magazines  pens  and paper removed hand sanitizer in guest accommodation and key areas process in place to check health of guests first aid kit available contactless check-in/check-out cashless payment available physical distancing rules followed screens or physical barriers placed between staff and guests in appropriate areas property is cleaned by professional cleaning companies all plates  cutlery  glasses and other tableware have been sanitized guests have the option to cancel any cleaning services for their accommodation during their stay breakfast takeaway containers delivered food is securely covered","97167681555","1311","images/baraccuda.jpg"
"32","Umm al Quwain","Palma Beach Resort & Spa","ThreeStar","Al Hamra Area , Sheikh Ahmed Al Mualla Road Al Hamra AreaP.O. Box 1279Umm al-Quwain ","488",,"Designed with a blend of modern and ancient Pharonic Egypt, Palma Beach Resort and Spa is situated on the shore of Arabian Sea. It features free WiFi in all areas, 3 outdoor swimming pools including a childrens pool, a private beach area and a spa.

The warmly decorated accommodations feature a balcony with either a sea or pool view. Each one includes a satellite TV, a minibar and a DVD player. The suite includes a living room with dining area.

Palma Restaurant specializes in authentic International cuisines prepared with fresh ingredients. Palma coffee shop is situated on the beachside and serves light snacks, beverages and meals. Room service is available 24 hours.

Palma’s spa offers a range of relaxing massage treatments complimented by the sauna, all upon request. The gym is equipped with cardiovascular machines to help with an energizing workout. For entertainment, a games room, table tennis and billiards are available.

The Dream land aqua park is only a 25-minute drive away from Palma Beach Resort and Spa. Dubai International Airport is 45 minutes by car. An airport shuttle is available upon request. Please inform Palma Beach Resort & Spa in advance of your expected arrival time. You can use the Special Requests box when booking, or contact the property directly with the contact details provided in your confirmation.
Guests are required to show a photo identification and credit card upon check-in. Please note that all Special Requests are subject to availability and additional charges may apply.
Payment before arrival via bank transfer is required. The property will contact you after you book to provide instructions.
In response to Coronavirus (COVID-19), additional safety and sanitation measures are in effect at this property.
Due to Coronavirus (COVID-19), this property is taking steps to help protect the safety of guests and staff. Certain services and amenities may be reduced or unavailable as a result.","00971 (0)67667388","Free parking internet services express check-in/check-out Parking Safety Deposit Box Restaurant Currency exchange Spa and wellness centre Billiards Room service meeting/banquet facilities 24-hour front desk Sauna Fitness centre Garden Terrace Airport shuttle Business centre Laundry Facilities for disabled guests Barber/beauty shop Family rooms Games room breakfast in the room Ironing service Security alarm Smoke alarms indoor pool (all year) concierge service Special diet menus (on request) Trouser press airport shuttle (additional charge) Lockers minimarket on site Beachfront Daily housekeeping parking on site Private parking kids' outdoor play equipment Kid meals secured parking Street parking Accessible parking Wheelchair accessible Toilet with grab rails Higher level toilet Lower bathroom sink Emergency cord in bathroom Pool with view airport pick up airport drop off coffee house on site Sun umbrellas Outdoor furniture Picnic area Beauty Services Facial treatments Waxing services Make up services hair treatments Manicure Pedicure hair cut hair colouring hair styling Body Treatments Body scrub Body wrap Table tennis BBQ facilities Packed lunches Bowling hammam Heating Fax/photocopying Luggage storage wifi Indoor pool Outdoor pool Free WiFi Air conditioning designated smoking area Private beach area Sun terrace outdoor pool (all year) CCTV in common areas CCTV outside property Fire extinguishers Swimming pool use of cleaning chemicals that are effective against coronavirus linens  towels and laundry washed in accordance with local authority guidelines guest accommodation is disinfected between stays guest accommodation sealed after cleaning physical distancing in dining areas food can be delivered to guest accommodation staff follow all safety protocols as directed by local authorities shared stationery such as printed menus  magazines  pens  and paper removed hand sanitizer in guest accommodation and key areas process in place to check health of guests first aid kit available contactless check-in/check-out cashless payment available physical distancing rules followed mobile app for room service screens or physical barriers placed between staff and guests in appropriate areas invoice provided property is cleaned by professional cleaning companies all plates  cutlery  glasses and other tableware have been sanitized guests have the option to cancel any cleaning services for their accommodation during their stay breakfast takeaway containers delivered food is securely covered face masks for guests available Light therapy Spa Facilities Spa lounge/relaxation area Foot bath Spa/wellness packages Fitness fitness classes Personal trainer fitness/spa locker rooms kids' pool Swimming pool Beach 24-hour security Key access Key card access","1.07E+12","1279","images/palm beach.jpg"
